{
  "schema_version": "1.0",
  "project": "03｜KOMADEKI 資格試験アプリ量産",
  "product": "otsu4",
  "control_issue": 185,
  "status": "ACTIVE",
  "current_phase": "QUESTION_BANK_COMPLETION",
  "phase_order": [
    "QUESTION_BANK_COMPLETION",
    "FEATURE_COMPLETION",
    "PRODUCT_CLOSURE",
    "PHYSICAL_DEVICE",
    "STOREKIT_TESTFLIGHT",
    "APP_STORE_CONNECT",
    "FINAL_RELEASE_GATE",
    "SUBMIT",
    "DONE"
  ],
  "observed_main": "76a265dfc741c330c0831515b42ed187e339fadc",
  "next_atomic_objective": "AUTHOR_AND_PERSIST_OTSU4_BATCH_3_AI_PRE_ACCEPT",
  "autonomous_acceptance": "AI_GOVERNED",
  "review_identity_policy": "NEVER_FABRICATE_HUMAN",
  "local_only_state_authoritative": false,
  "repository_completion_rule": "DURABLE_GITHUB_EVIDENCE_REQUIRED",
  "human_blocker": null,
  "state_epoch": 34
}
